{
  "$schema": "https://json-schema.org/draft/2020-12/schema",
  "$id": "https://github.com/mhingston/pi-workflows/blob/main/schemas/workflow-manifest.schema.json",
  "title": "Pi workflow artifact manifest v1",
  "type": "object",
  "additionalProperties": false,
  "required": [
    "schemaVersion",
    "id",
    "version",
    "entrypoint",
    "sourceSha256",
    "inputSchema",
    "outputSchema",
    "requiredCapabilities",
    "dependencies"
  ],
  "properties": {
    "schemaVersion": {
      "const": 1
    },
    "id": {
      "type": "string",
      "pattern": "^[a-z][a-z0-9_-]*$",
      "maxLength": 128
    },
    "version": {
      "type": "string",
      "pattern": "^(0|[1-9]\\d*)\\.(0|[1-9]\\d*)\\.(0|[1-9]\\d*)(?:-((?:0|[1-9]\\d*|\\d*[A-Za-z-][0-9A-Za-z-]*)(?:\\.(?:0|[1-9]\\d*|\\d*[A-Za-z-][0-9A-Za-z-]*))*))?(?:\\+([0-9A-Za-z-]+(?:\\.[0-9A-Za-z-]+)*))?$"
    },
    "entrypoint": {
      "const": "workflow.ts"
    },
    "sourceSha256": {
      "type": "string",
      "pattern": "^[a-f0-9]{64}$"
    },
    "inputSchema": {
      "type": "object"
    },
    "outputSchema": {
      "type": "object"
    },
    "requiredCapabilities": {
      "type": "array",
      "uniqueItems": true,
      "items": {
        "type": "string",
        "pattern": "^[a-z][a-z0-9_-]*$",
        "maxLength": 128
      }
    },
    "dependencies": {
      "type": "object",
      "additionalProperties": {
        "type": "string",
        "minLength": 1
      }
    }
  }
}
