{
  "schemaVersion": 1,
  "id": "dynamic_agents",
  "version": "1.0.0",
  "entrypoint": "workflow.ts",
  "sourceSha256": "186e4890240c5d3592c4a40ddc5beddf8ca630b91f91d610bc619ecaa709c39a",
  "inputSchema": {
    "type": "object",
    "additionalProperties": false,
    "required": [
      "values",
      "requiresApproval"
    ],
    "properties": {
      "values": {
        "type": "array",
        "items": {
          "type": "number"
        }
      },
      "requiresApproval": {
        "type": "boolean"
      }
    }
  },
  "outputSchema": {
    "type": "number"
  },
  "requiredCapabilities": [
    "agent",
    "hooks",
    "approval",
    "dynamic_tasks"
  ],
  "dependencies": {
    "@earendil-works/pi-durable": "1.3.0"
  }
}
